Total Amount (รวมทั้งสิ้น),Total Amount (รวมจำนวนเงิน),
Total Amount Paid,จำนวนเงินที่จ่าย,
Total Gross Amount,ยอดรวมสุทธิ,
Total Gross Salary,เงินเดือนรวมทั้งหมด,
Total Income Tax Deducted,ยอดรวมภาษีหัก ณ ที่จ่าย,
Total Invoices,ยอดรวมใบแจ้งหนี้,
Total Provident Fund,รวมกองทุนสำรองเลี้ยงชีพ,
Total Social Security,ประกันสังคมรวม,
Total Tax Withheld,รวมภาษีหัก ณ ที่จ่าย,
Total WHT Certificates,ใบรับรองภาษีหัก ณ ที่จ่ายรวมทั้งหมด,
Totals,รวมทั้งหมด,
UOM,หน่วยนับ,
Upload signature image file,อัปโหลดไฟล์รูปภาพลายเซ็นต์,
Uploaded Image,ไม่พบข้อความที่ต้องแปลในภาพที่อัปโหลด กรุณาอัปโหลดข้อความหรือภาพที่มีข้อความเพื่อให้ฉันช่วยแปลได้ค่ะ,
Urgent,ด่วน,
Usage Count,จำนวนการใช้งาน,
Usage Purpose,วัตถุประสงค์การใช้งาน,
Use Custom Position,ใช้ตำแหน่งที่กำหนดเอง,
User,ผู้ใช้,
User Forum,ฟอรั่มผู้ใช้,
Validate Tax ID Checksum,ตรวจสอบผลรวมรหัสประจำตัวผู้เสียภาษี,
Verdana,Verdana,
View Website,ดูเว็บไซต์,
WHT Amount (ภาษีหัก ณ ที่จ่าย),จำนวนภาษีหัก ณ ที่จ่าย (WHT Amount),
WHT Certificate,ใบรับรองภาษีหัก ณ ที่จ่าย,
WHT Certificate Information,ข้อมูลใบรับรองภาษี ณ ที่จ่าย,
WHT Condition (เงื่อนไขการหัก),เงื่อนไขการหักภาษี ณ ที่จ่าย (Withholding Tax),
WHT Rate (%),อัตรา ภาษีหัก ณ ที่จ่าย (%),
WHT Rate (อัตราภาษี %),อัตราภาษีหัก ณ ที่จ่าย (%),
Watermark Mode,โหมดลายน้ำ,
Watermark Settings,การตั้งค่าน้ำหมึก,
Watermark Template,เทมเพลตลายน้ำ,
Watermark Templates,เทมเพลตลายน้ำ,
Withholding Tax Certificate,ใบรับรองภาษีหัก ณ ที่จ่าย,
Withholding Tax Certificates,ใบรับรองภาษีหัก ณ ที่จ่าย,
Withholding Tax Details,รายละเอียดภาษีหัก ณ ที่จ่าย,
Withholding Tax Details (รายละเอียดภาษีหัก ณ ที่จ่าย),รายละเอียดภาษีหัก ณ ที่จ่าย,
Workflow State,สถานะเวิร์กโฟลว์,
Year,ปี,
Year Buddhist,,
จำนวนเงินที่ใช้คำนวณภาษี (ไม่รวม VAT),,
ภ.ง.ด.1ก Form Number,ภ.ง.ด.1ก หมายเลขแบบฟอร์ม,
ภ.ง.ด.1ก Submission Date,วันที่ส่ง ภ.ง.ด.1ก,
ยอดรวมทั้งหมด (รวม VAT),,
